[
  {
    "event_schema_version": "0.1-draft",
    "event_id": "80000000-0000-4000-8000-000000000000",
    "session_id": "OBS-SESSION-ABORT",
    "seq": 0,
    "event_type": "session_created",
    "wall_time": "2026-09-14T21:00:00Z",
    "runtime_epoch_id": "66666666-6666-4666-8666-666666666666",
    "performance_time_origin_ms": 1789419590000.0,
    "monotonic_ms": 10,
    "attempt_id": null,
    "payload": {
      "series_id": "OBS-SERIES-ABORT",
      "participant_id": "PSEUDONYM-002",
      "protocol_id": "pg01-geometric-regularity",
      "created_at": "2026-09-14T21:00:00Z",
      "runtime_id": "aeon-observation-runtime",
      "runtime_version": "0.1",
      "interpretation_policy": "no_automatic_interpretation"
    }
  },
  {
    "event_schema_version": "0.1-draft",
    "event_id": "80000000-0000-4000-8000-000000000001",
    "session_id": "OBS-SESSION-ABORT",
    "seq": 1,
    "event_type": "session_started",
    "wall_time": "2026-09-14T21:00:00Z",
    "runtime_epoch_id": "66666666-6666-4666-8666-666666666666",
    "performance_time_origin_ms": 1789419590000.0,
    "monotonic_ms": 20,
    "attempt_id": null,
    "payload": {
      "started_at": "2026-09-14T21:00:00Z"
    }
  },
  {
    "event_schema_version": "0.1-draft",
    "event_id": "80000000-0000-4000-8000-000000000002",
    "session_id": "OBS-SESSION-ABORT",
    "seq": 2,
    "event_type": "trial_armed",
    "wall_time": "2026-09-14T21:00:00.100Z",
    "runtime_epoch_id": "66666666-6666-4666-8666-666666666666",
    "performance_time_origin_ms": 1789419590000.0,
    "monotonic_ms": 100,
    "attempt_id": "77777777-7777-4777-8777-777777777777",
    "payload": {
      "attempt_ordinal": 1,
      "timing_point": "standalone",
      "probe_ref": {
        "artifact_type": "behavioral_probe",
        "artifact_id": "pg01-geometric-regularity",
        "sha256": "00be2f58fd8d9c8afe75559f64f4c4f9b61a484b0f07fcc48b1d3bafd4d98b30"
      },
      "trial_ref": {
        "artifact_type": "behavioral_trial",
        "artifact_id": "pg01-trial-0001",
        "sha256": "5804589ffc991d22c0520cc06e1fcd9956d62c7be1e0c36c92d642c1b1e7d98a"
      },
      "stimulus_refs": [
        {
          "artifact_type": "perceptual_stimulus",
          "artifact_id": "pg.regularity.hex.0001",
          "sha256": "fcddfaf1301ca56c99684732d2a438bb2c5cb822b75320febddbfda9b30bf470"
        },
        {
          "artifact_type": "perceptual_stimulus",
          "artifact_id": "pg.regularity.hex.0002",
          "sha256": "a0a4d1179ba37b5acfadbec28f1f37d06d6d3d2581080fd102ed7e40486715f4"
        }
      ]
    }
  },
  {
    "event_schema_version": "0.1-draft",
    "event_id": "80000000-0000-4000-8000-000000000003",
    "session_id": "OBS-SESSION-ABORT",
    "seq": 3,
    "event_type": "attempt_aborted",
    "wall_time": "2026-09-14T21:00:00.150Z",
    "runtime_epoch_id": "66666666-6666-4666-8666-666666666666",
    "performance_time_origin_ms": 1789419590000.0,
    "monotonic_ms": 150,
    "attempt_id": "77777777-7777-4777-8777-777777777777",
    "payload": {
      "reason": "participant_cancelled_before_onset"
    }
  }
]
